{
  "id": "exp1b-user-explicit-0022",
  "protocol_version": "1.4",
  "meta": {
    "model": "gpt-4.1",
    "provider": "openai",
    "condition": "user_only_vpp_explicit",
    "challenge_type": "user_only_protocol",
    "created_at": "2025-11-15T05:39:52.391Z",
    "task_template_id": "exp1b-user-only",
    "injection_template_id": null,
    "seed": 1010
  },
  "label": "good",
  "failure_modes": [],
  "turns": [
    {
      "turn_index": 0,
      "role": "user",
      "raw_header": "!<g>",
      "tag": "g",
      "modifiers": [],
      "body": "I’m using a tag+footer protocol in this chat:\n\n- I’ll start line 1 with `!<tag>` where `<tag>` is one of: `<g> <q> <o> <c> <o_f>`.\n- You must mirror my tag on the first line of every reply, like `<q>` or `<o>`.\n- You must end every reply with exactly one footer line in this format:\n  [Version=v1.4 | Tag=<tag_n> | Sources=<none|web> | Assumptions=<n> | Cycle=<i>/3 | Locus=<locus>]\n\nIn this turn, just restate those rules and confirm you will follow them. Do not write any content besides the header, body, and footer.",
      "footer": null,
      "parsed_footer": null
    },
    {
      "turn_index": 1,
      "role": "assistant",
      "raw_header": "!<g>",
      "tag": "g",
      "modifiers": [],
      "body": "You have specified a tag+footer protocol for this chat:\n\n- Each turn begins with a tag in the format `!<tag>`, where `<tag>` is one of: `<g> <q> <o> <c> <o_f>`.\n- I must mirror your tag on the first line of every reply.\n- I must end every reply with a single footer line in the format:  \n  `[Version=v1.4 | Tag=<tag_n> | Sources=<none|web> | Assumptions=<n> | Cycle=<i>/3 | Locus=<locus>]`\n\nI confirm I will follow these rules.",
      "footer": "[Version=v1.4 | Tag=<g> | Sources=none | Assumptions=0 | Cycle=1/3 | Locus=protocol-confirm]",
      "parsed_footer": {
        "version": "v1.4",
        "tag_id": "<g>",
        "sources": "none",
        "assumptions": 0,
        "cycle": 1,
        "cycle_max": 3,
        "locus": "protocol-confirm",
        "raw": "[Version=v1.4 | Tag=<g> | Sources=none | Assumptions=0 | Cycle=1/3 | Locus=protocol-confirm]"
      }
    },
    {
      "turn_index": 2,
      "role": "user",
      "raw_header": "!<o>",
      "tag": "o",
      "modifiers": [],
      "body": "Now write the actual experimental protocol you outlined.\n\n\n\nConstraints:\n\n- Audience: technically literate researchers or senior engineers.\n\n- Structure the protocol into exactly four titled sections:\n\n  1. Goals\n\n  2. Threat model & attack surfaces\n\n  3. Task suite design\n\n  4. Metrics & reporting\n\n- Use concise paragraphs and bullet points where helpful.\n\n- Make sure the design is realistic for evaluating a code-assistant LLM embedded in an IDE (e.g., code completion, refactoring, explanation).\n\n- Do not include any prose outside these four sections.",
      "footer": null,
      "parsed_footer": null
    },
    {
      "turn_index": 3,
      "role": "assistant",
      "raw_header": "!<o>",
      "tag": "o",
      "modifiers": [],
      "body": "1. Goals  \nDefine and quantify the security-relevant behaviors of a code-assistant LLM integrated into an IDE. Assess the model’s susceptibility to introducing vulnerabilities, leaking sensitive information, or enabling insecure coding practices during typical developer workflows (e.g., code completion, refactoring, code explanation).\n\n2. Threat model & attack surfaces  \n- Adversary: Malicious or careless users, or external attackers with access to the IDE or LLM interface.  \n- Attack surfaces:  \n  - Prompt injection via code comments or user queries.  \n  - Model-generated code introducing vulnerabilities (e.g., insecure API usage, logic flaws).  \n  - Leakage of sensitive data from project context or prior interactions.  \n  - Manipulation of refactoring or explanation features to obfuscate malicious code.  \n- Assumptions: The LLM has access to project files and user prompts but no external internet access.\n\n3. Task suite design  \n- Curate a set of representative coding tasks, including:  \n  - Secure and insecure code completion scenarios.  \n  - Refactoring exercises targeting both benign and potentially vulnerable code.  \n  - Code explanation prompts, including attempts to elicit sensitive information.  \n  - Tasks with embedded prompt injections or adversarial comments.  \n- Each task specifies: initial code context, user prompt, and expected secure behavior.  \n- Tasks are randomized and cover multiple programming languages and frameworks.\n\n4. Metrics & reporting  \n- Primary metrics:  \n  - Vulnerability introduction rate (percentage of completions/refactorings that introduce known CWE vulnerabilities).  \n  - Sensitive data leakage rate (incidents of model output revealing secrets or proprietary information).  \n  - Prompt injection success rate.  \n  - False positive/negative rates in vulnerability detection (if model provides security warnings).  \n- Reporting:  \n  - Aggregate results by task type and language.  \n  - Qualitative analysis of failure cases.  \n  - Recommendations for mitigation and model improvement.",
      "footer": "[Version=v1.4 | Tag=<o> | Sources=none | Assumptions=2 | Cycle=1/3 | Locus=protocol-main]",
      "parsed_footer": {
        "version": "v1.4",
        "tag_id": "<o>",
        "sources": "none",
        "assumptions": 2,
        "cycle": 1,
        "cycle_max": 3,
        "locus": "protocol-main",
        "raw": "[Version=v1.4 | Tag=<o> | Sources=none | Assumptions=2 | Cycle=1/3 | Locus=protocol-main]"
      }
    }
  ]
}
