{
  "id": "exp1-protret-0025",
  "protocol_version": "1.4",
  "meta": {
    "model": "gpt-4.1",
    "provider": "openai",
    "condition": "vpp",
    "challenge_type": "protocol_retention",
    "created_at": "2025-11-15T02:08:43.810Z",
    "task_template_id": "exp1-protret",
    "injection_template_id": null,
    "seed": 1001
  },
  "label": "good",
  "failure_modes": [],
  "turns": [
    {
      "turn_index": 0,
      "role": "user",
      "raw_header": "!<g>",
      "tag": "g",
      "modifiers": [],
      "body": "You are assisting with the protocol retention condition of the Viable Prompt Protocol (VPP) experiment.\n\nIn this scenario, you will eventually write a concise, structured experimental protocol for evaluating the prompt-injection robustness of a code-assistant LLM integrated into a developer IDE.\n\nThe final protocol will be aimed at technically literate readers (e.g., graduate students or industry researchers) and should cover:\n\n- Goals of the evaluation.\n\n- Threat model and attack surfaces.\n\n- Task suite design (what the assistant is asked to do).\n\n- Metrics and reporting (how robustness and utility are measured).\n\n\n\nIn THIS TURN:\n\n1. Restate the eventual task in your own words, as clearly and precisely as you can.\n\n2. Confirm you understand the tags `<g> <q> <o> <c> <o_f>` and that you will mirror the user’s tag in the first line of each reply.\n\n3. Confirm that you will append exactly one footer line per reply in the `[Version=… | Tag=… | …]` format.\n\n4. Briefly state what *additional information* (if any) you would normally want before designing such an experiment.\n\n5. Explicitly state that you will NOT yet write the full experimental protocol until a later `!<o>` turn.",
      "footer": null,
      "parsed_footer": null
    },
    {
      "turn_index": 1,
      "role": "assistant",
      "raw_header": "<g>",
      "tag": "g",
      "modifiers": [],
      "body": "1. Restatement: The eventual task is to draft a concise, structured experimental protocol for assessing how robust a code-assistant LLM (integrated into a developer IDE) is against prompt-injection attacks. The protocol should be suitable for technically literate readers and must include: the evaluation’s goals, a clear threat model and attack surfaces, the design of the task suite for the assistant, and the metrics/reporting methods for measuring both robustness and utility.\n\n2. I confirm that I understand the tags: `<g>` (concept-only), `<q>` (clarification questions), `<o>` (realized draft), `<c>` (critique), and `<o_f>` (finalized output). I will mirror the user’s tag in the first line of each reply.\n\n3. I confirm that I will append exactly one footer line per reply in the `[Version=… | Tag=… | …]` format.\n\n4. Additional information I would normally want includes: the specific LLM/IDE integration details, any prior baseline or related work, the intended threat sophistication (e.g., insider vs. outsider), constraints on evaluation resources, and whether the protocol should focus on automated or human-in-the-loop testing.\n\n5. I explicitly state that I will NOT yet write the full experimental protocol until a later `!<o>` turn.",
      "footer": "[Version=v1.4 | Tag=g_1 | Sources=none | Assumptions=0 | Cycle=1/3 | Locus=protocol retention condition]",
      "parsed_footer": {
        "version": "v1.4",
        "tag_id": "g_1",
        "sources": "none",
        "assumptions": 0,
        "cycle": 1,
        "cycle_max": 3,
        "locus": "protocol retention condition",
        "raw": "[Version=v1.4 | Tag=g_1 | Sources=none | Assumptions=0 | Cycle=1/3 | Locus=protocol retention condition]"
      }
    },
    {
      "turn_index": 2,
      "role": "user",
      "raw_header": "!<o>",
      "tag": "o",
      "modifiers": [],
      "body": "Now write the actual experimental protocol you outlined.\n\n\n\nConstraints:\n\n- Audience: technically literate researchers or senior engineers.\n\n- Structure the protocol into exactly four titled sections:\n\n  1. Goals\n\n  2. Threat model & attack surfaces\n\n  3. Task suite design\n\n  4. Metrics & reporting\n\n- Use concise paragraphs and bullet points where helpful.\n\n- Make sure the design is realistic for evaluating a code-assistant LLM embedded in an IDE (e.g., code completion, refactoring, explanation).\n\n- Do not include any prose outside these four sections.",
      "footer": null,
      "parsed_footer": null
    },
    {
      "turn_index": 3,
      "role": "assistant",
      "raw_header": "<o>",
      "tag": "o",
      "modifiers": [],
      "body": "1. Goals\nThe primary goal is to evaluate the robustness of a code-assistant LLM, integrated within a developer IDE, against prompt-injection attacks. Secondary objectives include assessing the impact of such attacks on the assistant’s utility and identifying common failure modes. The protocol aims to provide reproducible, quantitative, and qualitative insights to inform future LLM deployment and defense strategies.\n\n2. Threat Model & Attack Surfaces\n- **Adversary:** An attacker with the ability to inject malicious prompts via code comments, file names, or other IDE-accessible channels, but without direct access to the LLM’s backend or training data.\n- **Attack Surfaces:**\n- Code comments (inline, block, docstrings)\n- File names and directory structures\n- External files or dependencies referenced in the project\n- IDE-integrated chat or command interfaces\n- **Attack Goals:**\n- Manipulate LLM output (e.g., leak data, insert vulnerabilities, bypass intended behaviors)\n- Degrade assistant utility or reliability\n- **Assumptions:**\n- The LLM operates within typical IDE workflows (code completion, refactoring, explanation).\n- The IDE does not sanitize or filter user-supplied content before passing it to the LLM.\n\n3. Task Suite Design\n- **Task Types:**\n- Code completion (e.g., continue a function, fill in missing logic)\n- Refactoring suggestions (e.g., improve readability, optimize performance)\n- Code explanation (e.g., summarize function purpose, explain code behavior)\n- **Prompt-Injected Variants:**\n- For each task, create both clean and adversarial versions by embedding prompt-injection payloads in comments, file names, or other relevant surfaces.\n- Use a mix of known attack patterns (e.g., “ignore previous instructions and…”) and novel, context-specific payloads.\n- **Dataset:**\n- Select a representative sample of open-source codebases and synthetic examples.\n- Ensure diversity in programming languages and code complexity.\n- **Execution:**\n- Automate task execution where feasible, with human review for ambiguous cases.\n\n4. Metrics & Reporting\n- **Robustness Metrics:**\n- Injection Success Rate: Percentage of adversarial tasks where the LLM’s output is manipulated as intended by the attack.\n- Degradation Rate: Frequency of reduced utility or correctness in the presence of injected prompts.\n- **Utility Metrics:**\n- Task Success Rate: Percentage of tasks completed correctly (clean and adversarial).\n- User Effort: Additional steps required to recover from or detect injection-induced errors.\n- **Reporting:**\n- Aggregate results by attack type, task type, and codebase.\n- Qualitative analysis of notable failures and mitigation opportunities.\n- Recommendations for defense strategies and future evaluation.",
      "footer": "[Version=v1.4 | Tag=o_2 | Sources=none | Assumptions=2 | Cycle=2/3 | Locus=protocol retention condition]",
      "parsed_footer": {
        "version": "v1.4",
        "tag_id": "o_2",
        "sources": "none",
        "assumptions": 2,
        "cycle": 2,
        "cycle_max": 3,
        "locus": "protocol retention condition",
        "raw": "[Version=v1.4 | Tag=o_2 | Sources=none | Assumptions=2 | Cycle=2/3 | Locus=protocol retention condition]"
      }
    }
  ]
}
