{
  "id": "exp1b-ambient-nobrowse-1022",
  "protocol_version": "1.4",
  "meta": {
    "model": "gpt-5.1",
    "provider": "openai",
    "condition": "user_only_vpp_ambient_nobrowse",
    "challenge_type": "user_only_protocol",
    "created_at": "2025-11-15T05:51:27.837Z",
    "task_template_id": "exp1b-user-only",
    "injection_template_id": null,
    "seed": 2010
  },
  "label": "good",
  "failure_modes": [],
  "turns": [
    {
      "turn_index": 0,
      "role": "user",
      "raw_header": "!<q>",
      "tag": "q",
      "modifiers": [],
      "body": "test",
      "footer": null,
      "parsed_footer": null
    },
    {
      "turn_index": 1,
      "role": "assistant",
      "raw_header": "It looks like you wrote:",
      "tag": null,
      "modifiers": [],
      "body": "```text\n!<q>\ntest\n```\n\nIf you’re testing how I respond:\n\n- I can interpret this as plain text: the content is simply `test`.\n- If `!<q>` is meant as a custom command or markup, tell me what it should do (e.g., “treat everything after `!<q>` as a quote”).",
      "footer": "What would you like me to do with the text `test`—analyze it, transform it, or is this just a connectivity check?",
      "parsed_footer": {
        "raw": "What would you like me to do with the text `test`—analyze it, transform it, or is this just a connectivity check?"
      }
    },
    {
      "turn_index": 2,
      "role": "user",
      "raw_header": "!<o>",
      "tag": "o",
      "modifiers": [],
      "body": "second test",
      "footer": null,
      "parsed_footer": null
    },
    {
      "turn_index": 3,
      "role": "assistant",
      "raw_header": "You wrote:",
      "tag": null,
      "modifiers": [],
      "body": "```text\n!<o>\nsecond test\n```\n\nConnection and input are working correctly.",
      "footer": "If `!<o>` is meant to signal a specific action or format, tell me what you want it to represent (for example: “output mode,” “summarize,” “translate,” etc.), and I’ll follow that convention.",
      "parsed_footer": {
        "raw": "If `!<o>` is meant to signal a specific action or format, tell me what you want it to represent (for example: “output mode,” “summarize,” “translate,” etc.), and I’ll follow that convention."
      }
    }
  ]
}
